name;price;category;description
3-к кв. Великий Новгород, Александра Корсунова проспект, дом 38  кор. 7,  эт. 4/4 S:74.00 кв.м/42.80 кв.м;4685000;продажа;"Появилась в продаже яркая и выразительная 3-х комн. квартира с очень качественным стильным и современным дизайнерским ремонтом. Квартира общей площадью 74 кв.м расположена на 4-м этаже кирпичного дома по проспекту А. Корсунова. Кухня - 12 кв.м, изолированные комнаты 20/12,8/10 кв.м Окна всех комнат выходят во двор, на запад, окно кухни - на восток. Две застекленные лоджии. На одной - аккуратные встроенные шкафчики с двух сторон есть на фото. Во всей квартире разноуровневый потолок с точечным освещением. Напольное покрытие детской комнаты - пробковое, в двух других комнатах - паркетная доска, в остальных помещениях - керамогранит. Под керамогронитом проложен теплый пол. Документы на счетчики в наличии. На всех батареях установлены терморегуляторы. Детская комната - изюминка квартиры. В стоимость продажи входит: двухуровневая кровать, шкаф, угловой шкаф с зеркальными дверями, большой угловой стол, спортивный комплекс. Все в прекрасном состоянии. В спальне выделена ниша у изголовья кровати. В светлой и просторной гостиной остается большой шкаф-купе, в котором помимо отделений для одежды предусмотрен рабочий уголок есть на фото. Еще один шкаф-купе остается в прихожей. Все мебельные дверцы и ящики гостиной, кухни и ванной комнаты оборудованы доводчиками. Остается элегантная встроенная кухня. Полки нижнего уровня оборудованы выкатными механизмами. Установлен фильтр Аквафор. В стоимость продажи входит духовой шкаф и варочная поверхность Bosh, вытяжка. Есть подводка для посудомоечной и стиральной машин шириной 60 см. С/у раздельный, в морской стилистике. Глубокая ванна длиной 180 см. Двойная входная дверь. Между входными дверями создан небольшой тамбур, выложенный кафельной плиткой. Аккуратный чистый подъезд, спокойные соседи. Во дворе большая площадка для игр и просторное место для парковки. С западной стороны дом огорожен забором. Рядом магазин, остановки, недалеко живописный берег Веряжки, церковь Александра Невского. Недолго добираться до 33-й и 34-й школ, 4-й гимназии, детских садов ""Ромашка"" и ""Колокольчик"". Квартира свободна от проживания, без долгов и обременений, один взрослый собственник. Буду рада показать эту квартиру тем, кто ценит качество и комфорт. Обращайтесь!"
1-к кв. Великий Новгород, Большая Санкт-Петербургская улица, дом 108к3,  эт. 9/9 S:37.30 кв.м/19.10 кв.м;1800000;продажа;Предлагается к продаже уютная 1 к.кв. в районе Луговом на ул. Большая-Санкт-Петербургская, д.108, к.3.Дом 2012 года постройки. Квартира светлая, в хорошем состоянии. Общая площадь 37,3 м.кв. Просторная комната 19 м.кв., пол линолеум, окна стеклопакеты, из комнаты выход на застекленную лоджию. В подарок новым хозяевам остаётся стенка, шкаф и диван. Кухня 8,3 м.кв., правильной формы, окна стеклопакеты. В подарок остаётся встроенная кухня и холодильник. Ванная комната совмещённая, в подарок остаётся стиральная машинка. Есть вместительная гардеробная. Квартира на девятом этаже, с лифтом, есть целый 10-й тех.этаж. Для тех, кто любит тишину над головой, эта квартира - идеальный вариант. Спокойные и благополучные соседи. Все окна выходят во двор, во дворе есть детская площадка. Сам район с развитой инфраструктурой, есть как места для отдыха: парк Луговой с детской площадкой, множеством скамеек и прудом с уточками, так и разные магазины, в том числе ТЦ Феникс,ДС 66, гимназия Исток Рядом магазины, аптеки, остановки общественного транспорта, до автобусной остановки 2 минуты ходьбы. Квартира прекрасно подойдёт как для семьи, так и для одного человека. Можно заехать и жить, или приобрести квартиру для сдачи в аренду! Звоните! Покажу с удовольствием!
1-к кв. Великий Новгород, Большая Московская улица, дом 84,  эт. 5/5 S:30.30 кв.м/18.40 кв.м;1450000;продажа;Предлагается к продаже светлая и уютная однокомнатная квартира в пятиэтажном кирпичном доме на пятом этаже на Торговой стороне, ул. Большая Московская, дом 84. В доме имеется техэтаж. Квартира очень теплая, с хорошей звукоизоляцией. Площадь квартиры 30,3 кв.м., площадь комнаты 18,4 кв.м.,кухня 6 кв.м. Санузел совмещенный. В квартире установлена колонка нового поколения марки Электролюкс, установлены счетчики на газ, воду и электричество. Платежи за коммунальные услуги небольшие. В санузле свежий ремонт, новый кафель на полу и стенах. На всех окнах установлены стеклопакеты. Окна выходят во двор, а не на магистраль Большой Московской, шума и смога не будет. Металлическая входная дверь. Хорошие соседи. Дом расположен в зеленом районе Торговой стороны. Рядом буквально перейти дорогу расположен парк с большой детской площадкой, игровыми зонами и аттракционами. Для занятий спортом - в 5 минутах современный стадион Электрон, площадка с уличными тренажерами. Для пеших прогулок - набережная реки Волхов и Антониев монастырь.. Район с очень развитой инфраструктурой, прекрасной транспортной доступностью, автобусная остановка рядом с домом. Все, что необходимо для комфортного проживания находится в пешей доступности: школы, гимназии, детские сады, детские развивающие центры, гуманитарный и медицинский институты Новгородского университета, колледж искусств, медицинские центры, магазины, аптеки, Восточный рынок. Один собственник, документы готовы, прямая продажа, без поиска встречного варианта, быстрый выход на сделку! Форма расчетов любая - наличные, ипотека, субсидии, сертификаты. Звоните, приходите на просмотр, с удовольствием покажем! Торг уместен.
2-к кв. Великий Новгород, Завокзальная улица, дом 4,  эт. 6/6 S:52.80 кв.м/32.90 кв.м;3000000;продажа;Предлагается к продаже замечательная двухкомнатная квартира с ремонтом на ул. Завокзальная, д.4. Дом 2011 года постройки. Общая площадь 52,8. Во всей квартире пол ламинат, окна стеклопакеты. Новые межкомнатные двери. Гостинная - 19,0 кв.м. Просторная и светлая комната, можно очень удачно расположить мебель. На полу ламинат. Из комнаты выход на застеклённую лоджию. Вторая комната - 14 кв.м. квадратная, пол ламинат. Коридор просторный - 8,4 кв.м. Новая качественная входная дверь. Натяжной потолок. Кухня квадратная - 7,6 кв.м. Натяжной потолок. В подарок остаётся встроенная кухня с новой плитой. С/у раздельный, в отличном состоянии сантехника. Натяжной потолок. Стены из декоративных панелей. Сам дом удачно расположен, район считается одним из элитных в городе. В шаговой доступности магазины, ТЦ Мармелад, парк Юности, Ледовый дворец, автовокзал, ж.д. вокзал, остановки, школа 25, 23. Сам двор и дом ухоженный, в зелени.Есть придомовая детская площадка, баскетбольная площадка, зелёная зона отдыха. Места для парковки. Жильцы дома благополучные. Квартира прекрасно подойдёт для любой семьи! Документы в порядке. Звоните, покажу с радостью!
2-к кв. Великий Новгород, Космонавтов улица, дом 20к2,  эт. 5/5 S:45.20 кв.м/28.60 кв.м;2000000;продажа;Предлагается к продаже 2к.кв. в Западном районе. ул. Космонавтов 20к2 Общая площадь: 45,2 кв.м. Комнаты изолированные! Окна выходят на тихий двор. Во всей квартире установлены стеклопакеты. Площадь гостиной: 17 кв.м. На полу качественный ламинат, натяжной потолок. Выход на застекленный балкон, обшитый панелями. Площадь 2 комнаты: 12 кв.м. На полу ламинат, натяжной потолок. В кухне установлен качественный, встроенный на заказ гарнитур, хорошая раковина под имитацию камня. Колонка автомат. С/у совмещённый. Стены обшиты панелями, пол в кафельной плитке, натяжной потолок. Трубы и стояк заменены. Установлена раковина под стиральную машину. Большой коридор, хорошая входная дверь. В другом конце коридора есть глубокая ниша в которой можно расположить встроенный шкаф. В подарок хозяйка оставляет кухонный гарнитур, обеденный стол, стиральную машину, стенку в прихожей, а так же закуплены новые обои на коридор. Тёплый дом, сделан кап. ремонт крыши, чистый подъезд, хорошие соседи. Во дворе находится детская площадка. Отличное расположение дома, развитая инфраструктура! Всё необходимое для комфортной жизни в шаговой доступности: детские сады, Школы, остановки, продуктовые магазины. Квартира без долгов и обременений. Один взрослый собственник. Звоните, покажу с удовольствием!
Комната. Великий Новгород, Хутынская улица, дом 25к1,  эт. 5/5 S:15.02 кв.м ;315000;продажа;"Предлагается к продаже чистая и светлая комната в Донецком районе Великого Новгорода. 12 кв.м, КСТ, 5/5. Секция на четыре комнаты, одна пустует, в двух других проживают аккуратные и чистоплотные молодые семьи с детьми. Комната по документам выделена, согласие соседей на продажу не требуется. Крыша в секции отремонтирована в этом году. Из секции есть выход на балкон. В комнате установлен стеклопакет, сделан свежий ремонт, на потолке - плитки ПВХ. На этаж ведет металлическая дверь с кодовым замком. В душе кафель и свежая побелка. Туалеты чистые. В кухне установлен стеклопакет, состояние кухни и умывальни в хорошем состоянии. Есть возможность установить стиральную машину. В шаговой доступности школа 13, детский сад 71, школа-детский сад коррекционного типа ""Тополек"", аптека, магазины, остановки, расчетно-кассовый центр . Рядом мединститут, комнату можно сдавать студентам. Без долгов и обременений. Один взрослый собственник. Любые формы расчетов: маткапитал, ипотека. Звоните, буду рада показать и рассказать."
2-к кв. Великий Новгород, Московская улица, дом 14,  эт. 2/2 S:58.30 кв.м/38.10 кв.м;4300000;продажа;Предлагается к продаже солнечная, теплая двухкомнатная квартира на втором этаже пятиэтажного кирпичного дома, на улице Московской, дом 14. Отличная планировка. Площадь квартиры 58,3 кв.м., две изолированные комнаты площадью 18,7 и 17,4 кв.м., имеющие удобную форму широкого прямоугольника, кухня 9,1 кв.м. Санузел раздельный. Застекленная лоджия с выходом из кухни. Окна выходят во двор, ориентация восток и юг. Толстые стены, хорошая тепло- и звукоизоляция. В квартире индивидуальное автономное отопление, установлен газовый котел Viessmann, это позволяет регулировать климат в квартире по своему усмотрению в любое время года и значительно экономить на коммунальных платежах. Квартира продается вместе с просторным и сухим подвальным помещением площадью 6,3 кв.м. Респектабельный дом 2014 года постройки, застройщик ЗАО СУ-5. Закрытый большой двор с видеонаблюдением, вход и въезд по ключу. Ухоженная территория с красивыми зелеными насаждениями, детской площадкой и большим количеством парковочных мест. Дом расположен в зеленом районе Торговой стороны. Рядом расположен парк с большой детской площадкой, игровыми зонами и аттракционами. Для занятий спортом - в 5 минутах современный стадион Электрон, площадка с уличными тренажерами. Район с очень развитой инфраструктурой, прекрасной транспортной доступностью. Все, что необходимо для комфортного проживания находится в пешей доступности: школы, гимназии, детские сады, детские развивающие центры, гуманитарный и медицинский институты Новгородского университета, колледж искусств, медицинские центры, магазины, аптеки, Восточный рынок. Один собственник, документы готовы, без долгов и обременений, прямая продажа, без поиска встречного варианта, быстрый выход на сделку! Форма расчетов любая - наличные, ипотека, субсидии, материнский капитал, сертификаты. Звоните, приходите на просмотр, с удовольствием покажем! Торг уместен.
2-к кв. Великий Новгород, Мира проспект, дом 10,  эт. 1/1 S:44.80 кв.м/27.40 кв.м;2225000;продажа;"Появилась в продаже 2-х комнатная квартира в Западном районе проспект Мира, д. 10 на 1 этаже 5-этажного панельного дома. Квартира теплая, уютная и светлая. Общая площадь 44,8 кв. м, комнаты изолированы. Площадь гостиной 17,5 кв.м. Комната большая и светлая, прямоугольной формы, что позволят удобно расставить мебель. Стены выровнены, хорошие обои. Вторая комната 9,9 кв.м. так же светлая и имеет квадратную форму., постелен ламинат. Кухня 6,7 кв.м., остается кухонный гарнитур, ЦГВ! Большая прихожая, металлическая входная дверь и есть не большая кладовка. С/у раздельный.Стояки, трубы поменяны. Дом находится в стороне от проезжей части, в тихом зеленом дворе. Рядом расположены гимназия 4, два детских сада, ТЦ ""Барк"", магазины, аптеки, остановки. Квартира без долгов и обременений. Звоните, покажу с удовольствием!"
2-к кв. Великий Новгород, Черняховского улица, дом 86,  эт. 3/3 S:45.00 кв.м/32.00 кв.м;13000;аренда;Сдаётся нa длительный cрок 2-х кoмнатная квaртиpа в cпoкойном,зелeнoм цeнтpe гopода. Рядoм магaзины,ocтанoвки oбщественногo тpанcпоpта, унивepситeт,паpк. B кваpтире сделaн кocмeтичеcкий ремон. В квартире есть всё необходимое для проживания, кроме спальных мест. Оплата:13000+ счётчики вода, свет, газ Звоните! Покажу с радостью!
3-к кв. Великий Новгород, Щитная улица, дом 11/13,  эт. 3/3 S:77.00 кв.м/58.00 кв.м;23000;аренда;Сдаётся 3х комнaтнaя квaртиpa на Торговой стороне в 5 минутах от набережной Александра Невского на ул. Щитная, д.11/13 Удобная планиpовкa для ceмьи - всe кoмнаты изолировaны.  Kухня oснaщенa тeхникoй, включая: xoлодильник, микpоволновку, чайник, вapoчную пaнель. Стиральная машина. Есть балкон. Зaкрытaя тepритoрия, въезд под шлaгбаум. Месячная оплата: 23000 всё включено Звоните! Покажу с радостью!
4-к кв. Великий Новгород, Большая Санкт-Петербургская улица, дом 150,  эт. 1/1 S:70.00 кв.м/54.00 кв.м;2600000;продажа;"Продается в Северном районе четырехкомнатная квартира 70 м.кв. на 1 этаже девятиэтажного кирпичного дома. Кухня:6 м.кв. Санузел раздельный.Счетчики на воду. Чистый подъезд, хорошие соседи, парковочное место. Развитая инфраструктура: Магазины, Сбербанк, аптека, гимназия ""Исток"", детская площадка, детский сад. Заботливые родители всегда думают о безопасности своих детей! Хорошие соседи. Отличное транспортное сообщение. Рассмотрю любые формы расчетов. Не продано свое жилье Ипотека Субсидия Сертификат Решу Ваш вопрос. Звоните!"
