name;price;category;description
1-к кв. Великий Новгород, Каберова-Власьевская улица, дом 15,  эт. 3/3 S:30.90 кв.м/17.20 кв.м;9000;аренда;"Сдам 1к кв. в центре Великого Новгорода, до Кремлевского парка и реки Волхов - 5 мин, до институтов НовГу 15 мин. В шаговой доступности два детских сада, магазин. Квартира чистая, запахов нет. Есть кладовка и балкон, окна выходят во двор, стеклопакеты. Установлена колонка-автомат, счетчики. Отличный напор воды. В доме есть тепловой узел, контролирующий мощность нагрева батарей. В наличии небольшой холодильник, чайник, утюг, телевизор, пылесос. Собственник может установить стиральную машинку ""Малютка"", либо стир. машину б/у после оплаты первого месяца проживания. Оплата 9000 руб. + счетчики + залог 3000 руб. Квартира подойдет для проживания женщины с ребенком, студента института экономики и управления, института непрерывного пелагогического образования НовГУ им. Ярослава Мудрого. Звоните, покажу и расскажу с радостью."
3-к кв. Великий Новгород, Большая Московская улица, дом 114к1,  эт. 5/5 S:60.60 кв.м/46.20 кв.м;2150000;продажа;Предлагается к продаже 3 к.кв на Торговой стороне на ул. Большая Московская, д.114 к1 на 5 этаже для дружной семьи. Дом кирпичный, общая площадь квартиры 60,6 м.кв, комнаты смежно-изолированные, есть балкон, застеклен и обшит деревом. Квартира светлая, тёплая, в обычном состоянии. Есть две вместительные кладовки. Зал 17,5 м.кв пол деревянный, окно выходит на улицу Б.Московская. Вторая комната - 13 м.кв, пол деревянный, окно также выходит на улицу. Третья комната 15,7 м.кв, пол деревянный, окно во двор. Кухня 5,9 м.кв, сделан фартук из плитки, газовая плита Hansa, колонка полу-автомат, окно выходит во двор. С/у раздельный, в кафеле, сантехника в хорошем состоянии. Трубы поменяны, установлен счетчик. Во всей квартире установлены стеклопакеты. Квартира ждет хозяина, готового вложить средства в создание качественного и элегантного жилья. Отличное расположение дома в сочетании с развитой инфраструктурой! Всё необходимое для комфортной жизни в шаговой доступности. Магазины, рынок, школы, детские сады, кафе, больницы, остановки. Недалеко расположен большой парк с детскими развлечениями и площадками, набережная для вечерних прогулок! Благополучные жители дома. Без долгов и обременений, свободна от проживания, один взрослый собственник. Буду рада вашим звонкам, готова показать квартиру в любой день.
2-к кв. Великий Новгород, Большая Санкт-Петербургская улица, дом 89а,  эт. 1/1 S:54.00 кв.м/36.00 кв.м;1500000;продажа;"Продается в Северном районе светлая, чистая двухкомнатная квартира на 1 этаже двухэтажного кирпичного дома, общая площадь 54 м.кв, перекрытия железо-бетонные.Комнаты изолированные, правильной формы. Окна ориентированы на юг, стекло-пакеты. Кухня:6 м.кв.Большая прихожая. Санузел совмещенный.Счетчики на воду,бойлер. Чистый подъезд, металлическая входная дверь. Развитая инфраструктура: Магазины: Дикси, Магнит, аптека в шаговой доступности, гимназия ""Исток"", детская площадка, парк Луговой. Квартира без обременения, документы в порядке. Отличное транспортное сообщение. Рассмотрю любые формы расчетов. Не продано свое жилье Ипотека Субсидия Сертификат Решу Ваш вопрос. Звоните! Покажу в удобное для Вас время."
2-к кв. Шимск рп, зеленая, дом 10,  эт. 1/1 S:30.80 кв.м/20.00 кв.м;830000;продажа;Предлагается к продаже двухкомнатная квартира в кирпичном одноэтажном четырехквартирном жилом доме на земельном участке 7,18 соток в п.г.т. Шимск. Шимск расположен в 48 км от г. Великий Новгород. Дом обшит сайдингом. Общая площадь квартиры 30,8 кв.м. В квартире 3 комнаты. В двух комнатах на полу ламинат, поклеены свежие обои. В третьей комнате стены окрашены. Во всей квартире установлены стеклопакеты и межкомнатные двери. В квартире выложена новая печка с духовкой. На участке построен новый дровяник для хранения дров. Дом может стать прекрасным вариантом как для постоянного проживания, так и для загородного отдыха. В шаговой доступности грибы и ягоды. Для любителей рыбной ловли в двух минутах ходьбы река Шелонь. В поселке есть магазины, поликлиника, больница, школа, детский сад, автовокзал. Один совершеннолетний собственник. Прямая продажа. Звоните, покажу с удовольствием!
Комната. Великий Новгород, Щусева улица, дом 8к4,  эт. 2/2 S:210.00 кв.м ;250000;продажа;"Продается в Северном районе комната 13,7 м.кв коридорного типа, на 2 этаже двухэтажного кирпичного дома 1985 года постройки. Перекрытия железо-бетонные, комната правильной формы. Окна, дверь и пол деревянные. Чистые:кухня, умывальник,прачечная, туалет. На 1 этаже душевая, закрывается на замок. Развитая инфраструктура: магазины: Эконом, Дикси, Магнит, аптека, Сбербанк, гимназия ""Исток"", детская площадка, парк Луговой. 5 мин до реки Волхов. Люди гуляют по берегу, летом загорают и купаются. Комната без обременения, документы в порядке. Отличное транспортное сообщение. Рассмотрю любые формы расчетов. Не продано свое жилье Ипотека Субсидия Сертификат Решу Ваш вопрос. Звоните! Покажу в удобное для Вас время."
2-к кв. Панковское городское поселение пгт, Индустриальная, дом 6к2,  эт. 3/3 S:48.10 кв.м/27.90 кв.м;1800000;продажа;Предлагается к продаже 2-х комнатная квартира в пгт. Панковка на 3 этаже 5-этажного кирпичного дома 2000 года. Квартира теплая, уютная и светлая в обычном состоянии. Общая площадь 48,1 кв. м, комнаты изолированы, выходят на разные стороны. Площадь гостиной 14,6 кв.м. Комната большая и светлая, прямоугольной формы, что позволят удобно расставить мебель. Вторая комната 13,3 кв.м. так же светлая и имеет квадратную форму. Кухня 8 кв.м., ЦГВ! Из кухни выход на вместительную застекленную лоджию. Большая прихожая 8,2 кв.м. С/у раздельный. Стояки, трубы поменяны. Квартира свободна от проживания, ждет уверенных и хозяйских рук! Дом находится в стороне от проезжей части, в тихом дворе. Рядом расположены детский сад, школа, магазины, аптека, остановки. Квартира без долгов и обременений. Рассмотрю любые формы расчетов. Не продано свое жилье Ипотека Субсидия Сертификат Решу Ваш вопрос. Звоните! Покажу в удобное для Вас время.
2-к кв. Панковское городское поселение пгт, Индустриальная, дом 25А,  эт. 1/1 S:55.40 кв.м/26.80 кв.м;1500000;продажа;Предлагается к продаже 2х комнатная квартира, 1/3 кирпичного дома 1999 г.п. на Индустриальной улице дом 25А. Общая площадь 55,4 кв.м. Изолированные комнаты 12,2/14,6 кв.м Кухня: 11,5 кв.м. Современный кухонный гарнитур, позволит Вам готовить с комфортом! На полу ламинат, натяжной потолок. Помещения правильной прямоугольной формы. С/у раздельный, новая душевая кабина. Все трубы и стояки поменяны. В одной комнате имеется просторная кладовая, которую можно сделать гардеробной. Просторная прихожая, в которой также натяжной потолок и ламинат. Во всей квартире установлены стеклопакеты. Дом находится в стороне от проезжей части, в тихом дворе. Рядом расположены детский сад, школа, магазины, аптека, остановки. Квартира без долгов и обременений, один взрослый собственник. Квартира ждет уверенных хозяйских рук. Рассмотрю любые формы расчетов. Не продано свое жилье Ипотека Субсидия Сертификат Решу Ваш вопрос. Звоните! Покажу в удобное для Вас время.
2-к кв. Великий Новгород, Ворошилова улица, дом 13,  эт. 6/6 S:55.00 кв.м/33.00 кв.м;16000;аренда;Свежее предложение! Двухкомнатная квартира в новом доме на длительный срок! Ранее не сдавалась. Оснащена всей необходимой мебелью и бытовой техникой 3 телевизора, холодильник, стиральная машина, утюг, пылесос Готова к заселению. Звоните, покажу с удовольствием!
2-к кв. Великий Новгород, Парковая улица, дом 18к3,  эт. 3/3 S:50.00 кв.м/37.00 кв.м;11000;аренда;Сдаётся 2 к.квартира на Торговой стороне ул.Парковая, д.18 к.3. Квартира тёплая в кирпичном доме, на третьем этаже, с застеклённой лоджией. В квартире из техники есть стиральная машина, холодильник. Из мебели в одной комнате: шкаф и односпальная кровать. Во второй комнате, стенка, стол и телевизор, нет спального места. Квартира подойдёт для любой семьи. Звоните, покажу с удовольствием!
2-к кв. Великий Новгород, Кочетова улица, дом 8к1,  эт. 3/3 S:53.00 кв.м/36.00 кв.м;14000;аренда;Сдается отличная, уютная и просторная двухкомнатная квартира в панельном девятиэтажном доме 2005 года постройки на третьем этаже. Общая площадь 53 кв.м., площадь кухни 7,5 кв.м., две изолированные комнаты площадью 19 и 17 кв.м., есть лоджия, раздельный санузел, центральное горячее водоснабжение. В квартире имеется вся необходимая мебель, холодильник, телевизор, газовая плита, стиральная машина, микроволновка, а также набор посуды. Из спальных мест есть раскладывающийся диван и две кровати. Кабельное телевидение и интернет. Район с очень развитой инфраструктурой, прекрасной транспортной доступностью. Все, что необходимо для комфортного проживания находится в пешей доступности: школы, детские сады, медицинские центры, магазины, Кочетовский торговый комплекс, развлекательные центры. Отличное место для проживания и отдыха. Сдается некурящим, без животных. Арендная плата 14 000 руб. + счетчики, комиссия 7 000 руб.
Комната. Великий Новгород, Ветеранов улица, дом 8,  эт. 5/5 S:50.00 кв.м ;300000;продажа;Предлагается к продаже комната 17,1 кв.м. в общежитии коридорного типа. Комната без ремонта, но установлен стеклопакет. Сделано зонирование, выделена зона кухни и прихожей. Выложен кафель и повешена вытяжка. Комната ждет уверенных хозяйских рук. Места общего пользования в нормальном состоянии. Дом расположен в районе с отличной инфраструктурой: школа, детский сад, магазины, почта, баня, СТО, платная стоянка, остановка городского автотранспорта. Звоните, покажу в удобное для Вас время!
4-к кв. Великий Новгород, Связи улица, дом 7,  эт. 3/3 S:61.40 кв.м/44.40 кв.м;2500000;продажа;"Предлагается к продаже 4х комнатная квартира 3/5 кирпичного дома на Торговой стороне на улице Связи. Общая площадь 61,4 кв.м, кухня 5,98 кв.м. Одна комната изолированная, три смежно-изолированные. Два застекленных балкона выходят на разные стороны. Помещения правильной прямоугольной формы, что позволит с комфортом расставить мебель. С/у раздельный, кафель, заменены трубы. Аккуратный чистый подъезд. Во дворе достаточное количество парковочных мест. Отличное расположение дома в сочетании с развитой инфраструктурой! Всё необходимое для комфортной жизни в шаговой доступности. Магазины, школы, гимназия с дошкольным отделением ""Квант"", детские сады, кафе, больницы, остановки. Недалеко расположен большой парк с детскими развлечениями и площадками, набережная для вечерних прогулок! Свободна от проживания, ждет уверенных хозяйских рук. Звоните, покажу с удовольствием!"
3-к кв. Великий Новгород, Псковская улица, дом 18к3,  эт. 3/3 S:60.00 кв.м/36.00 кв.м;3450000;продажа;Большая светлая квартира. Кухня-гостиная, две комнаты, раздельный санузел. В квартире сделан качественный ремонт.Тихий зелёный двор, рядом школа, детский сад. Отличное месторасположение, близко к центрупарковая зона, Кремль. Остаётся вся мебель и техника. Квартира подойдёт как для молодой, так и пожилой семьи. У нас интеллигентные и тихие соседи! Перепланировка узаконена , квартира без обременений, подходит для всех видов расчётов. Ждём ваших звонков, ответим на все вопросы.
Участок. Ситно деревня,  S:21.00 сот ;200000;продажа;Продается участок в д. Ситно. Участок в собственности, коммуникации рядом, хороший подъезд, разрешение на строительство, первая линия реки Волхов.
Участок. Мясной Бор деревня ,  S:15.00 сот ;400000;продажа;Деревня расположена на федеральной автомобильной дороге Россия М10 и в 1 километре на пересечении с трассой М11, между Спасской Полистью и Подберезьем. Восточнее деревни берёт начало река Питьба- левый приток Волхова.Участок 15 соток, без построек, электричество проходит по границе участка, в собственности, без ограничений и обременений. Документы готовы к продаже.Организованы пригородные автобусные маршруты.
Участок. Окуловка, Перестовская улица,  S:516.00 сот ;2100000;продажа;Предлагается к продаже земельный участок 5,1 га, расположенный в Окуловском районе с/п Турбинное, северная часть кадастрового квартала, 9 км от г. Окуловки и ж/д станции с развитой инфраструктурой. Участок примыкает к деревне Пузырёво Окуловского района. Категория земель: земли населенных пунктов, вид разрешенного использования: для сельскохозяйственного производства. С участка есть выход на берег озера 50 метров, также рядом протекает речка. Съезд на участок с асфальтированной дороги. Вдоль дороги есть линия электропередачи есть техническая возможность подключения электричества. Участки ровные без холмов, канав, косится трава, деревья и кусты вырублены. В 10 минутах езды скоростная трасса Санкт-Петербург - Москва участок уже построен. Участок в собственности, не обременен, документы готовы к продаже. Можно запросить видео с участка через WhatsApp. Звоните, покажу с удовольствием!
Участок. Панковка рп, ул. Заречный, массив 3 СТ Сад,12А,  S:10.00 сот ;70000;продажа;В сезон летнего ажиотажа! Продам земельный участок 9.8 соток под загородное строительство или дачу. Объект расположен по адресу Заречный, массив 3 СТ Сад. 10 км от города. Участок размежеванный, сухой, долгое время не разрабатывался. Половину участка занимают дубы и березы, вторая половина является берегом пруда, который может обыграть уже новый собственник и создать на своем загородном участке незабываемый по красоте, райский уголок. Имеется дорога к участку, вдоль дороги электричество есть возможность подключения. Соседи активно застраиваются так как участок находится близко к городу. Место очень перспективное. Свежий воздух, тишина, спокойствие и красота. Документы в порядке, один собственник. Кадастровый номер: 53:11:2631101:135 и 53:11:2631101:134. Хорошее транспортное сообщение с городом. От остановки 10 минут. Звоните прямо сейчас!!!
Участок. Любытино рп,  S:258.00 сот ;300000;продажа;Продам земельный участок в Любытинском районе, с/п Любытинское, участок находиться рядом с деревней Ушково, вплотную примыкает к деревне, электричество рядом, до д. Каменка 3 км грунтовой дороги, далее асфальт. Участок примыкает к дороге. Вокруг участка находится три живописных озера, недалеко есть ключ с питьевой водой. В деревне построен гостевой дом, туда круглогодично приезжают рыбаки и охотники.Документы в порядке, один собственник, рассмотрим все виды оплаты.
